
[
  {
    "id": "university-admission",
    "title": "বিশ্ববিদ্যালয় ভর্তি প্রস্তুতি",
    "description": "ঢাকা, রাজশাহী, চট্টগ্রাম, জাহাঙ্গীরনগরসহ সকল পাবলিক বিশ্ববিদ্যালয়ের পূর্ণাঙ্গ প্রস্তুতি।",
    "icon": "University",
    "slug": "বিশ্ববিদ্যালয়-ভর্তি-প্রস্তুতি",
    "stats": [
      { "value": "۲۰+", "label": "বিশ্ববিদ্যালয়" },
      { "value": "৫টি", "label": "প্রধান বিষয়" },
      { "value": "১০০+", "label": "মডেল টেস্ট" }
    ],
    "features": [
      "লাইভ ক্লাস",
      "রেকর্ডেড ক্লাস",
      "লেকচার শিট",
      "ডেইলি এক্সাম",
      "সাপ্তাহিক এক্সাম",
      "প্রশ্নব্যাংক সলভ",
      "মেন্টরশিপ প্রোগ্রাম"
    ],
    "forWhom": [
      "HSC-24 পরীক্ষার্থী",
      "সেকেন্ড টাইমার",
      "যারা পাবলিক বিশ্ববিদ্যালয়ে পড়তে চায়"
    ]
  },
  {
    "id": "medical-dental-admission",
    "title": "মেডিকেল ও ডেন্টাল ভর্তি",
    "description": "মেডিকেল ও ডেন্টাল কলেজে ভর্তির জন্য বিশেষায়িত কোর্স ও মডেল টেস্ট।",
    "icon": "HeartPulse",
    "slug": "মেডিকেল-ও-ডেন্টাল-ভর্তি",
    "stats": [
      { "value": "সকল", "label": "মেডিকেল কলেজ" },
      { "value": "৩টি", "label": "প্রধান বিষয়" },
      { "value": "১৫۰+", "label": "মডেল টেস্ট" }
    ],
    "features": [
      "বিশেষজ্ঞ ডাক্তারদের ক্লাস",
      "মেইন বই দাগানো পিডিএফ",
      "প্রতিটি অধ্যায়ের উপর পরীক্ষা",
      "ফাইনাল মডেল টেস্ট",
      "প্রশ্নব্যাংক সলভ",
      "বিশেষ টিপস ও ট্রিকস"
    ],
    "forWhom": [
      "HSC-24 পরীক্ষার্থী (বিজ্ঞান)",
      "যারা ডাক্তার হতে চায়",
      "সেকেন্ড টাইমার"
    ]
  },
  {
    "id": "engineering-admission",
    "title": "ইঞ্জিনিয়ারিং প্রস্তুতি (BUET, KUET, RUET, CUET)",
    "description": "বুয়েটসহ সকল ইঞ্জিনিয়ারিং বিশ্ববিদ্যালয়ের জন্য ফিজিক্স, কেমিস্ট্রি, ম্যাথ এর উপর বিশেষ কোর্স।",
    "icon": "Cog",
    "slug": "ইঞ্জিনিয়ারিং-প্রস্তুতি-buet-kuet-ruet-cuet",
    "stats": [
      { "value": "৪টি", "label": "প্রধান বিশ্ববিদ্যালয়" },
      { "value": "৩টি", "label": "প্রধান বিষয়" },
      { "value": "কনসেপ্ট বুক", "label": "ফ্রি" }
    ],
    "features": [
      "বুয়েটের ভাইয়াদের ক্লাস",
      "টাইপ-ভিত্তিক 문제 সমাধান",
      "শর্টকাট টেকনিক",
      "অনলাইন ও অফলাইন পরীক্ষা",
      "কনসেপ্ট ক্লিয়ারিং ক্লাস",
      "প্রশ্ন এনালাইসিস"
    ],
    "forWhom": [
      "HSC-24 পরীক্ষার্থী (বিজ্ঞান)",
      "যারা ইঞ্জিনিয়ার হতে চায়",
      "গণিত ও পদার্থবিজ্ঞানে আগ্রহী"
    ]
  },
  {
    "id": "gst-admission",
    "title": "গুচ্ছ প্রস্তুতি (GST)",
    "description": "গুচ্ছভুক্ত ২২টি সাধারণ এবং বিজ্ঞান ও প্রযুক্তি বিশ্ববিদ্যালয়ের সমন্বিত প্রস্তুতি।",
    "icon": "Blocks",
    "slug": "গুচ্ছ-প্রস্তুতি-gst",
    "stats": [
      { "value": "২২টি", "label": "বিশ্ববিদ্যালয়" },
      { "value": "৩টি", "label": "ইউনিট" },
      { "value": "সমন্বিত", "label": "প্রস্তুতি" }
    ],
    "features": [
      "ইউনিট-ভিত্তিক আলাদা ব্যাচ",
      "সকল বিষয়ের পূর্ণাঙ্গ ক্লাস",
      "প্রতিটি বিশ্ববিদ্যালয়ের প্রশ্ন সলভ",
      "কম খরচে সেরা প্রস্তুতি",
      "যেকোনো স্থান থেকে অংশগ্রহণের সুযোগ"
    ],
    "forWhom": [
      "HSC-24 পরীক্ষার্থী (সকল বিভাগ)",
      "যারা কম খরচে প্রস্তুতি নিতে চায়",
      "একাধিক বিশ্ববিদ্যালয়ের জন্য প্রস্তুতি"
    ]
  },
  {
    "id": "hsc-board-exam",
    "title": "HSC বোর্ড পরীক্ষার প্রস্তুতি",
    "description": "বিজ্ঞান, মানবিক ও ব্যবসায় শিক্ষা শাখার সকল বিষয়ের উপর পূর্ণাঙ্গ প্রস্তুতি কোর্স।",
    "icon": "BookMarked",
    "slug": "hsc-বোর্ড-পরীক্ষার-প্রস্তুতি",
    "stats": [
      { "value": "সকল", "label": "বোর্ড" },
      { "value": "সকল", "label": "বিষয়" },
      { "value": "A+", "label": "লক্ষ্য" }
    ],
    "features": [
      "বোর্ড পরীক্ষকদের ক্লাস",
      "টেস্ট পেপার সলভিং",
      "সাজেশন ও নোটস",
      "বোর্ড পরীক্ষার অনুরূপ মডেল টেস্ট",
      "ضعيف শিক্ষার্থীদের জন্য বিশেষ ব্যবস্থা"
    ],
    "forWhom": [
      "HSC-25 ব্যাচ",
      "HSC-26 ব্যাচ",
      "যারা বোর্ডে ভালো ফলাফল করতে চায়"
    ]
  },
  {
    "id": "iba-bup-admission",
    "title": "IBA ও BUP প্রস্তুতি",
    "description": "IBA (DU, JU) ও BUP এর ভর্তি পরীক্ষার জন্য বিশেষ ইংরেজি ও গণিত কোর্স।",
    "icon": "Briefcase",
    "slug": "iba-ও-bup-প্রস্তুতি",
    "stats": [
      { "value": "৩টি", "label": "শীর্ষ প্রতিষ্ঠান" },
      { "value": "বিশেষ", "label": "ইংরেজি ও গণিত" },
      { "value": "IBA Grads", "label": "দ্বারা পরিচালিত" }
    ],
    "features": [
      "IBA গ্র্যাজুয়েটদের দ্বারা ক্লাস",
      "Vocabulary ও Analytical Ability-র উপর জোর",
      "ভাইভা প্রস্তুতি",
      "বিগত বছরের প্রশ্ন বিশ্লেষণ",
      "এক্সক্লুসিভ স্টাডি ম্যাটেরিয়াল"
    ],
    "forWhom": [
      "যারা বিবিএ পড়তে আগ্রহী",
      "যাদের ইংরেজিতে ভালো দক্ষতা আছে",
      "চ্যালেঞ্জ নিতে আগ্রহী শিক্ষার্থী"
    ]
  }
]
